DIGNIDAD_CODIGO,DIGNIDAD_NOMBRE,CANDIDATO_CODIGO,CANDIDATO_NOMBRE,CANDIDATO_EDAD,ANIO,DIGNIDAD_NOMBRE_ESTANDAR,DIGNIDAD_CODIGO_ESTANDAR
4,ALCALDES MUNICIPALES,40982000000004.0,ACOSTA CAJAPE IGNACIO MELECIO,58,2014,ALCALDIA,4
4,ALCALDES MUNICIPALES,40982000000005.0,NAVARRO DIAZ JESSE JOHN,41,2014,ALCALDIA,4
4,ALCALDES MUNICIPALES,40982000000006.0,HEREDIA SEVILLA MIGUEL ANGEL,59,2014,ALCALDIA,4
4,ALCALDES MUNICIPALES,40982000000007.0,ABAD GARCIA JORGE ARMANDO,33,2014,ALCALDIA,4
4,ALCALDES MUNICIPALES,40982000000008.0,ARCE PLUAS ALEXANDRA MANUELA,36,2014,ALCALDIA,4
4,ALCALDES MUNICIPALES,40982000000009.0,RODAS RAMIREZ CARLOS GIOVANNI,53,2014,ALCALDIA,4
4,ALCALDES MUNICIPALES,40983500000001.0,VARGAS BRAVO RUTH MAGDALENA,31,2014,ALCALDIA,4
4,ALCALDES MUNICIPALES,40983500000002.0,TOMALA BRABO GRACIELA LEONOR,48,2014,ALCALDIA,4
4,ALCALDES MUNICIPALES,40983500000003.0,UGALDE YANEZ NICOLAS CONSTANTINO,32,2014,ALCALDIA,4
4,ALCALDES MUNICIPALES,40983500000004.0,LAMA GARCES CARLOS OLEGARIO,36,2014,ALCALDIA,4
4,ALCALDES MUNICIPALES,40983500000005.0,DIAZ CAISEDO JOHN FRANCISCO,50,2014,ALCALDIA,4
4,ALCALDES MUNICIPALES,40983500000006.0,MARTINEZ VILLACIS JUAN ALFREDO,50,2014,ALCALDIA,4
4,ALCALDES MUNICIPALES,40983500000007.0,HERRERA YANEZ JORGE EDUARDO,59,2014,ALCALDIA,4
4,ALCALDES MUNICIPALES,40983500000008.0,GARCIA TORRES CARLOS EUGENIO,28,2014,ALCALDIA,4
4,ALCALDES MUNICIPALES,40987000000001.0,ALVARADO AROCA EDSON RAFAEL,50,2014,ALCALDIA,4
4,ALCALDES MUNICIPALES,40987000000002.0,LAMILLA BENITEZ ANTONIO MIGUEL,39,2014,ALCALDIA,4
4,ALCALDES MUNICIPALES,40987000000003.0,PITA MACIAS JOSE ROBERTO,63,2014,ALCALDIA,4
4,ALCALDES MUNICIPALES,40987000000004.0,SUMBA QUINAPAYO MARIA DIOSELINA,79,2014,ALCALDIA,4
4,ALCALDES MUNICIPALES,40987000000005.0,LUZCANDO BARZOLA MANUEL ANDRES,24,2014,ALCALDIA,4
4,ALCALDES MUNICIPALES,40987000000006.0,SOLORZANO SANCHEZ MIGUEL ANGEL,46,2014,ALCALDIA,4
4,ALCALDES MUNICIPALES,40989000000001.0,SALAZAR BRITO VICTOR HUGO,58,2014,ALCALDIA,4
4,ALCALDES MUNICIPALES,40989000000002.0,PLAZA PALOMINO ELINA YESSENIA,36,2014,ALCALDIA,4
4,ALCALDES MUNICIPALES,40989000000003.0,CORDOVA MONTALVO JYMMY ALFREDO,52,2014,ALCALDIA,4
4,ALCALDES MUNICIPALES,40989000000004.0,FREIRE BAJANA JUSTA LUCIA,48,2014,ALCALDIA,4
4,ALCALDES MUNICIPALES,40989000000005.0,KUHN CORDOVA JUAN PABLO,40,2014,ALCALDIA,4
4,ALCALDES MUNICIPALES,40989000000006.0,MALDONADO AYOVI HENRY BYRON,49,2014,ALCALDIA,4
4,ALCALDES MUNICIPALES,40989000000007.0,JIMENEZ WILLIAMS MANUEL JOSE,64,2014,ALCALDIA,4
4,ALCALDES MUNICIPALES,40989000000008.0,ZUNIGA SANCHEZ FIDEL JUNIOR,44,2014,ALCALDIA,4
4,ALCALDES MUNICIPALES,40989000000009.0,REINOSO ORTIZ XAVIER ERNESTO,40,2014,ALCALDIA,4
4,ALCALDES MUNICIPALES,40989000000010.0,ORELLANA ORTIZ PEDRO ANTONIO,43,2014,ALCALDIA,4
4,ALCALDES MUNICIPALES,40989000000011.0,HERRERA ZUMBA NELSON MARCELO,40,2014,ALCALDIA,4
4,ALCALDES MUNICIPALES,40992000000001.0,HUNGRIA GONZALEZ ANDRES,54,2014,ALCALDIA,4
4,ALCALDES MUNICIPALES,40992000000002.0,MORAN ESPINOZA ISIDRO,51,2014,ALCALDIA,4
4,ALCALDES MUNICIPALES,40992000000003.0,PENAFIEL PENAFIEL GABRIEL OMAR,36,2014,ALCALDIA,4
4,ALCALDES MUNICIPALES,40992000000004.0,GONZALEZ VELASCO MARIA BREINYS,48,2014,ALCALDIA,4
4,ALCALDES MUNICIPALES,40992000000005.0,ESPINOZA ORTIZ VOLTAIRE,50,2014,ALCALDIA,4
4,ALCALDES MUNICIPALES,40992000000006.0,ESPINOZA ROMERO MAGALY BARTOLA,44,2014,ALCALDIA,4
4,ALCALDES MUNICIPALES,40992000000007.0,NAVARRETE BUENO SEGUNDO ARTURO,59,2014,ALCALDIA,4
4,ALCALDES MUNICIPALES,40994000000001.0,BAJANA ALMEIDA FILOMENA,52,2014,ALCALDIA,4
4,ALCALDES MUNICIPALES,40994000000002.0,ZAMBRANO ZAMBRANO RAMON AGUSTIN,58,2014,ALCALDIA,4
4,ALCALDES MUNICIPALES,40994000000003.0,ALVAREZ MARTILLO CINTHIA EMMA,34,2014,ALCALDIA,4
4,ALCALDES MUNICIPALES,40994000000004.0,LUNA CRIOLLO ROSEBELL STALIN,53,2014,ALCALDIA,4
4,ALCALDES MUNICIPALES,40994000000005.0,LUZARRAGA ROJAS MIGUEL ANGEL,44,2014,ALCALDIA,4
4,ALCALDES MUNICIPALES,40994000000006.0,CRUZ RONQUILLO FRANZ EDUARDO,34,2014,ALCALDIA,4
4,ALCALDES MUNICIPALES,40994000000007.0,JACOME ALVAREZ MARIANA DE JESUS,54,2014,ALCALDIA,4
4,ALCALDES MUNICIPALES,40998500000001.0,SANCHEZ MONTALVO RUPERTO ANIBAL,67,2014,ALCALDIA,4
4,ALCALDES MUNICIPALES,40998500000002.0,RIOS CARTAJENA WASHINGTON ENRIQUE,54,2014,ALCALDIA,4
4,ALCALDES MUNICIPALES,40998500000003.0,MINUCHE AGUILAR ROBERTO MAURICIO,47,2014,ALCALDIA,4
4,ALCALDES MUNICIPALES,40998500000004.0,MIRANDA SACOTO JOSE RUBEN,43,2014,ALCALDIA,4
4,ALCALDES MUNICIPALES,40998500000005.0,MATA CEDENO MARIO FERNANDO,42,2014,ALCALDIA,4
4,ALCALDES MUNICIPALES,40998500000006.0,CORDOVA PENAFIEL ITALO ALEJANDRO,56,2014,ALCALDIA,4
4,ALCALDES MUNICIPALES,40998600000001.0,MORAN MARTINEZ JOSE OSWALDO,47,2014,ALCALDIA,4
4,ALCALDES MUNICIPALES,40998600000002.0,MUNOZ MARTILLO RITA YEANNETTE,33,2014,ALCALDIA,4
4,ALCALDES MUNICIPALES,40998600000003.0,RONQUILLO AVILA CARLOS FRANCISCO,61,2014,ALCALDIA,4
4,ALCALDES MUNICIPALES,40998600000004.0,CRUZ ALVARADO STALIN MANUEL,37,2014,ALCALDIA,4
4,ALCALDES MUNICIPALES,40998600000005.0,INDACOCHEA SERRANO ANDRES GABRIEL,59,2014,ALCALDIA,4
4,ALCALDES MUNICIPALES,40998600000006.0,HINOJOSA CRUZ SEGUNDO TELESFORO,44,2014,ALCALDIA,4
4,ALCALDES MUNICIPALES,40998600000007.0,VALENCIA ALARCON ANABEL ESTHER,52,2014,ALCALDIA,4
4,ALCALDES MUNICIPALES,40998600000008.0,AGUA SOLORZANO CARLOS ALBERTO,41,2014,ALCALDIA,4
4,ALCALDES MUNICIPALES,40998600000009.0,CERCADO CHOEZ IGNACIO CARMELO,41,2014,ALCALDIA,4
4,ALCALDES MUNICIPALES,40998600000010.0,BAJANA MARTILLO MARCOS FILEMON,49,2014,ALCALDIA,4
4,ALCALDES MUNICIPALES,41003000000001.0,CASTILLO AGUIRRE ALVARO RAMIRO,49,2014,ALCALDIA,4
4,ALCALDES MUNICIPALES,41003000000002.0,ANDRADE AGUIRRE DAVID PATRICIO,60,2014,ALCALDIA,4
4,ALCALDES MUNICIPALES,41003000000003.0,MARTINEZ VASQUEZ JORGE FERNANDO,53,2014,ALCALDIA,4
4,ALCALDES MUNICIPALES,41003500000001.0,PAREJA CISNEROS GUSTAVO EDISON,67,2014,ALCALDIA,4
4,ALCALDES MUNICIPALES,41003500000002.0,VILLARREAL TOBAR ERNESTO FABIAN,64,2014,ALCALDIA,4
4,ALCALDES MUNICIPALES,41003500000003.0,GALARZA BASTIDAS CARLOS RAMIRO,60,2014,ALCALDIA,4
4,ALCALDES MUNICIPALES,41003500000004.0,CACHIMUEL GUALAPURO JOSE RODRIGO,40,2014,ALCALDIA,4
4,ALCALDES MUNICIPALES,41003500000005.0,CHALAMPUENTE MAIGUA FERNANDO ALFONSO,47,2014,ALCALDIA,4
4,ALCALDES MUNICIPALES,41003500000006.0,CONEJO MALDONADO MARIO HERNAN,54,2014,ALCALDIA,4
4,ALCALDES MUNICIPALES,41004000000001.0,SARZOSA NAVARRO LUIS FERNANDO,54,2014,ALCALDIA,4
4,ALCALDES MUNICIPALES,41004000000002.0,GOMEZ MORALES NORA MONSERRATT,39,2014,ALCALDIA,4
4,ALCALDES MUNICIPALES,41004000000003.0,ANRANGO BONILLA LUIS ALBERTO,66,2014,ALCALDIA,4
4,ALCALDES MUNICIPALES,41004000000004.0,CEVALLOS MORENO JOMAR JOSE EFREN,48,2014,ALCALDIA,4
4,ALCALDES MUNICIPALES,41004500000001.0,POSSO PADILLA FABIAN EFREN,54,2014,ALCALDIA,4
4,ALCALDES MUNICIPALES,41004500000002.0,POSSO JATIVA WASHINGTON RODRIGO,48,2014,ALCALDIA,4
4,ALCALDES MUNICIPALES,41004500000003.0,AGUIRRE NARVAEZ DORIS JANETH,39,2014,ALCALDIA,4
4,ALCALDES MUNICIPALES,41004500000004.0,POSSO ANDRADE OSWALDO RAMIRO,52,2014,ALCALDIA,4
4,ALCALDES MUNICIPALES,41005000000001.0,RIVERA GRIJALVA DANIEL RODRIGO,57,2014,ALCALDIA,4
4,ALCALDES MUNICIPALES,41005000000002.0,NARVAEZ ROSALES OSCAR ROLANDO,43,2014,ALCALDIA,4
4,ALCALDES MUNICIPALES,41005000000003.0,CHAVEZ AREVALO SAUL ARMANDO,50,2014,ALCALDIA,4
4,ALCALDES MUNICIPALES,41005000000004.0,PAREDES VALENZUELA IVAN ENRIQUE,55,2014,ALCALDIA,4
4,ALCALDES MUNICIPALES,41005500000001.0,SALAS RIVERA SEGUNDO MARCO TEODOMIRO,50,2014,ALCALDIA,4
4,ALCALDES MUNICIPALES,41005500000002.0,HUACA CALDERON JUAN PABLO,32,2014,ALCALDIA,4
4,ALCALDES MUNICIPALES,41005500000003.0,CRUZ PONCE VICTOR JULIO,45,2014,ALCALDIA,4
4,ALCALDES MUNICIPALES,41005500000004.0,VEGA GAYBOR TYRONE OSCAR,55,2014,ALCALDIA,4
4,ALCALDES MUNICIPALES,41129000000001.0,FIGUEROA AGURTO GILBERT ARMANDO,33,2014,ALCALDIA,4
4,ALCALDES MUNICIPALES,41129000000002.0,SALINAS MERINO MARCO VINICIO,43,2014,ALCALDIA,4
4,ALCALDES MUNICIPALES,41129000000003.0,GUERRERO LUZURIAGA JANET DEL CISNE,41,2014,ALCALDIA,4
4,ALCALDES MUNICIPALES,41129500000001.0,ROGEL VALDIVIEZO JORGE ALBERTO,41,2014,ALCALDIA,4
4,ALCALDES MUNICIPALES,41129500000002.0,VIDAL SARANGO OLIVER EFREN,40,2014,ALCALDIA,4
4,ALCALDES MUNICIPALES,41129500000003.0,ROGEL MONCADA NELLY YULIANA,31,2014,ALCALDIA,4
4,ALCALDES MUNICIPALES,41130000000001.0,ALTAMIRANO ARIAS FREDY OSWALDO,50,2014,ALCALDIA,4
4,ALCALDES MUNICIPALES,41130000000002.0,VILLAVICENCIO FREIRE JAIME FABIAN,44,2014,ALCALDIA,4
4,ALCALDES MUNICIPALES,41130000000003.0,ARROBO RODRIGUEZ PAULO CESAR,35,2014,ALCALDIA,4
4,ALCALDES MUNICIPALES,41130000000004.0,TORRES PAZ MARCELO VINICIO,39,2014,ALCALDIA,4
4,ALCALDES MUNICIPALES,41130000000005.0,CASTILLO VIVANCO JOSE BOLIVAR,68,2014,ALCALDIA,4
4,ALCALDES MUNICIPALES,41130000000006.0,BAILON ABAD JORGE ARTURO,67,2014,ALCALDIA,4
4,ALCALDES MUNICIPALES,41130500000001.0,SARANGO QUIZHPE SEGUNDO ABEL,40,2014,ALCALDIA,4
4,ALCALDES MUNICIPALES,41130500000002.0,ESPINOSA ORDONEZ WILLAN ARMANDO,41,2014,ALCALDIA,4
4,ALCALDES MUNICIPALES,41130500000003.0,MUNOZ SILVA ANDRES FERNANDO,33,2014,ALCALDIA,4
4,ALCALDES MUNICIPALES,41131000000001.0,FEIJOO VALAREZO JORGE LUIS,54,2014,ALCALDIA,4
4,ALCALDES MUNICIPALES,41131000000002.0,LOPEZ CORDOVA OVIDIO MANFREDO,42,2014,ALCALDIA,4
4,ALCALDES MUNICIPALES,41131000000003.0,MAITA SANCHEZ NERIO RAMIRO,52,2014,ALCALDIA,4
4,ALCALDES MUNICIPALES,41131000000004.0,VIDAL REQUELME VICTOR ARTEMIO,64,2014,ALCALDIA,4
4,ALCALDES MUNICIPALES,41131100000001.0,ARMIJOS BARRERA NESTOR RAUL,57,2014,ALCALDIA,4
4,ALCALDES MUNICIPALES,41131100000002.0,SANCHEZ ARMIJOS KLEVER ANTONIO,40,2014,ALCALDIA,4
4,ALCALDES MUNICIPALES,41131100000003.0,MARQUEZ JIMENEZ JORGE LUIS,43,2014,ALCALDIA,4
4,ALCALDES MUNICIPALES,41131500000001.0,RIOS HIDALGO ALONSO WILFRIDO,49,2014,ALCALDIA,4
4,ALCALDES MUNICIPALES,41131500000002.0,ORBE JUMBO MANUEL MAXIMILIANO,48,2014,ALCALDIA,4
4,ALCALDES MUNICIPALES,41131500000003.0,RAMON BUSTAMANTE ROSARIO PAOLA,40,2014,ALCALDIA,4
4,ALCALDES MUNICIPALES,41131500000004.0,ROMAN CALERO SEGUNDO SALVADOR,49,2014,ALCALDIA,4
4,ALCALDES MUNICIPALES,41131500000005.0,AYALA TORRES LUIS GERMAN,45,2014,ALCALDIA,4
4,ALCALDES MUNICIPALES,41132000000001.0,MEJIA TORRES ROBER ALFONSO,44,2014,ALCALDIA,4
4,ALCALDES MUNICIPALES,41132000000002.0,LOAIZA CAMPOVERDE HOMER ARMANDO,45,2014,ALCALDIA,4
4,ALCALDES MUNICIPALES,41132000000003.0,CUEVA BRAVO MARIO VICENTE,52,2014,ALCALDIA,4
4,ALCALDES MUNICIPALES,41132000000004.0,GUARNIZO CONDOLO JOSE WILFRIDO,51,2014,ALCALDIA,4
4,ALCALDES MUNICIPALES,41132000000005.0,CEVALLOS PENA SERAPIO REYMUNDO,47,2014,ALCALDIA,4
4,ALCALDES MUNICIPALES,41132000000006.0,JIMENEZ CABRERA EDILMA PIEDAD,47,2014,ALCALDIA,4
4,ALCALDES MUNICIPALES,41132500000001.0,SILVA VACA MARIO ESTUARDO,50,2014,ALCALDIA,4
4,ALCALDES MUNICIPALES,41132500000002.0,HIDALGO JARAMILLO EDITH MARLENE,44,2014,ALCALDIA,4
4,ALCALDES MUNICIPALES,41132500000003.0,VINAN RUEDA ROBERTO CARLOS,35,2014,ALCALDIA,4
4,ALCALDES MUNICIPALES,41132500000004.0,QUITO ORELLANA PEDRO LEOPOLDO,54,2014,ALCALDIA,4
4,ALCALDES MUNICIPALES,41133000000001.0,GRANDA DAVILA JOHNSON ERROLL,46,2014,ALCALDIA,4
4,ALCALDES MUNICIPALES,41133000000002.0,APOLO GRANDA ORLANDO MARCELO,46,2014,ALCALDIA,4
4,ALCALDES MUNICIPALES,41133000000003.0,TINOCO MONTANO VICTOR HUGO,56,2014,ALCALDIA,4
4,ALCALDES MUNICIPALES,41133000000004.0,GRANDA SANCHEZ CARLOS PATRICIO,37,2014,ALCALDIA,4
4,ALCALDES MUNICIPALES,41133500000001.0,GUEVARA RIVAS ELVIA DIGNA,34,2014,ALCALDIA,4
4,ALCALDES MUNICIPALES,41133500000002.0,JIMENEZ GONZALEZ BERNARDO EXZEQUIEL,51,2014,ALCALDIA,4
4,ALCALDES MUNICIPALES,41133500000003.0,HERRERA ROJAS PAULO PATRICIO,48,2014,ALCALDIA,4
4,ALCALDES MUNICIPALES,41133500000004.0,ESPINOZA LUNA NORMAN OMAR,44,2014,ALCALDIA,4
4,ALCALDES MUNICIPALES,41134000000001.0,TORRES JIMENEZ LUIS ANIBAL,53,2014,ALCALDIA,4
4,ALCALDES MUNICIPALES,41134000000002.0,GARCIA ONTANEDA ALVARO ANTONIO,53,2014,ALCALDIA,4
4,ALCALDES MUNICIPALES,41134000000003.0,ANDRADE ROJAS MANUEL DE JESUS,50,2014,ALCALDIA,4
4,ALCALDES MUNICIPALES,41134500000001.0,GUERRERO LAPO FREDI ENRIQUE,33,2014,ALCALDIA,4
4,ALCALDES MUNICIPALES,41134500000002.0,FLORES GUERRERO ORLI RENAN,57,2014,ALCALDIA,4
4,ALCALDES MUNICIPALES,41134500000003.0,SOTOMAYOR MENA LUIS BRANLY,50,2014,ALCALDIA,4
4,ALCALDES MUNICIPALES,41173000000001.0,SANCHEZ GONZALEZ GERMAN VICENTE,58,2014,ALCALDIA,4
4,ALCALDES MUNICIPALES,41173000000002.0,BUSTAMANTE CELI LIVAR GUILLERMO,39,2014,ALCALDIA,4
4,ALCALDES MUNICIPALES,41173000000003.0,MONTESDEOCA MONTESDEOCA HOLGER ALCIVAR,46,2014,ALCALDIA,4
4,ALCALDES MUNICIPALES,41173000000004.0,GRANDA OVACO ISAIAS GABRIEL,42,2014,ALCALDIA,4
4,ALCALDES MUNICIPALES,41173000000005.0,JUMBO LAPO BOLIVAR DE JESUS,34,2014,ALCALDIA,4
4,ALCALDES MUNICIPALES,41174000000001.0,CUEVA ROJAS MALVIN FREDY,53,2014,ALCALDIA,4
4,ALCALDES MUNICIPALES,41174000000002.0,TORRES MARIN TOBIAS NEPTALI,46,2014,ALCALDIA,4
4,ALCALDES MUNICIPALES,41174000000003.0,SAMANIEGO CUEVA JOHN OSWALDO,39,2014,ALCALDIA,4
4,ALCALDES MUNICIPALES,41174000000004.0,JARAMILLO ALVERCA FRANCISCO NEPTALI,56,2014,ALCALDIA,4
4,ALCALDES MUNICIPALES,41181500000001.0,LARGO MACHUCA VICTOR HUGO,60,2014,ALCALDIA,4
4,ALCALDES MUNICIPALES,41181500000002.0,CORDOVA ROBLES LIDER MOISES,44,2014,ALCALDIA,4
4,ALCALDES MUNICIPALES,41181500000003.0,DIAZ CAMPOVERDE DARWIN ESMITH,46,2014,ALCALDIA,4
4,ALCALDES MUNICIPALES,41251500000001.0,TERAN SALCEDO JONNY ENRIQUE,53,2014,ALCALDIA,4
4,ALCALDES MUNICIPALES,41251500000002.0,MIRANDA MEJIA JORGE JOFFRE,49,2014,ALCALDIA,4
4,ALCALDES MUNICIPALES,41251500000003.0,BARQUET TOUMA JUAN JOSE,65,2014,ALCALDIA,4
4,ALCALDES MUNICIPALES,41251500000004.0,PAZ MURILLO LUIS ALBERTO,45,2014,ALCALDIA,4
4,ALCALDES MUNICIPALES,41251500000005.0,HURTADO SORIANO HECTOR JOSE VICENTE,43,2014,ALCALDIA,4
4,ALCALDES MUNICIPALES,41251500000006.0,MANZANO SANCHEZ CARLOS JULIO,52,2014,ALCALDIA,4
4,ALCALDES MUNICIPALES,41251600000001.0,MARIN RODRIGUEZ WALTER ALFONSO,41,2014,ALCALDIA,4
4,ALCALDES MUNICIPALES,41251600000002.0,ANGULO CASTRO CRISTIAN STALIN,33,2014,ALCALDIA,4
4,ALCALDES MUNICIPALES,41251600000003.0,TROYA FUERTES JUAN CARLOS,42,2014,ALCALDIA,4
4,ALCALDES MUNICIPALES,41252000000001.0,ONOFRE CALDERON ANTONIO FELICISIMO,62,2014,ALCALDIA,4
4,ALCALDES MUNICIPALES,41252000000002.0,SANTILLAN PENAFIEL MANUEL EUSEBIO,60,2014,ALCALDIA,4
4,ALCALDES MUNICIPALES,41252000000003.0,VALENCIA VERA CRISTIAN FAVIAN,41,2014,ALCALDIA,4
4,ALCALDES MUNICIPALES,41252000000004.0,SALAZAR HIDALGO MONICA DE JESUS,35,2014,ALCALDIA,4
4,ALCALDES MUNICIPALES,41252000000005.0,PALACIOS VELASQUEZ SONIA LUCRECIA,44,2014,ALCALDIA,4
4,ALCALDES MUNICIPALES,41252000000006.0,ASPIAZU MONTIEL JOSE NARCISO,55,2014,ALCALDIA,4
4,ALCALDES MUNICIPALES,41252500000001.0,ALMEIDA MORAN PEDRO GONZALO,54,2014,ALCALDIA,4
4,ALCALDES MUNICIPALES,41252500000002.0,ROSERO GONZALEZ ISAAC GUILLERMO,63,2014,ALCALDIA,4
4,ALCALDES MUNICIPALES,41252500000003.0,SAENZ DE VITERI MENDOZA LAUTARO ENRIQUE,55,2014,ALCALDIA,4
4,ALCALDES MUNICIPALES,41252500000004.0,MONTALVAN CEREZO JUAN ALFONSO,32,2014,ALCALDIA,4
4,ALCALDES MUNICIPALES,41252500000005.0,VELIZ LLAGUNO EDGARDO ASATIANO,43,2014,ALCALDIA,4
4,ALCALDES MUNICIPALES,41252500000006.0,MENDOZA DOLBERG CHRISTIAN SEGUNDO,37,2014,ALCALDIA,4
4,ALCALDES MUNICIPALES,41252500000007.0,VILLASAGUA SANTANA CRISTIAN RAUL,37,2014,ALCALDIA,4
4,ALCALDES MUNICIPALES,41253000000001.0,CEPEDA BARCO MERCY MARIA,59,2014,ALCALDIA,4
4,ALCALDES MUNICIPALES,41253000000002.0,JARA CEREZO CESAR AMABLE,59,2014,ALCALDIA,4
4,ALCALDES MUNICIPALES,41253000000003.0,LAYEDRA BUSTAMANTE AGUSTIN EDUARDO,52,2014,ALCALDIA,4
4,ALCALDES MUNICIPALES,41253000000004.0,GUEDES NICOLA RICHARD STALIN,51,2014,ALCALDIA,4
4,ALCALDES MUNICIPALES,41253000000005.0,GONZALEZ NAVARRO MARCOS LUIS,48,2014,ALCALDIA,4
4,ALCALDES MUNICIPALES,41253000000006.0,ORTEGA BARZOLA CARLOS ENRIQUE,43,2014,ALCALDIA,4
4,ALCALDES MUNICIPALES,41253500000001.0,SUBIA VERA JOHN ARRY,50,2014,ALCALDIA,4
4,ALCALDES MUNICIPALES,41253500000002.0,ALAVA HUERTA BERTHA MARCELA,52,2014,ALCALDIA,4
4,ALCALDES MUNICIPALES,41253500000003.0,SUBIA VERA FRANCISCO EMILIO,59,2014,ALCALDIA,4
4,ALCALDES MUNICIPALES,41253500000004.0,DE LOOR MACIAS ELOY BENEDICTO,47,2014,ALCALDIA,4
4,ALCALDES MUNICIPALES,41253500000005.0,LARA CARRERA LUIS SEVERO,44,2014,ALCALDIA,4
4,ALCALDES MUNICIPALES,41253500000006.0,DUENAS MONTERO SOCRATES RODOLFO,52,2014,ALCALDIA,4
4,ALCALDES MUNICIPALES,41253500000007.0,JORGGE ALAVA IGNACIO JOFFRE,51,2014,ALCALDIA,4
4,ALCALDES MUNICIPALES,41253500000008.0,ZAMBRANO RODRIGUEZ AMADA ARGENTINA,38,2014,ALCALDIA,4
4,ALCALDES MUNICIPALES,41254000000001.0,OLVERA BARCIA VICTOR DAVID,43,2014,ALCALDIA,4
4,ALCALDES MUNICIPALES,41254000000002.0,GARCIA ESPINEL KERLY BEATRIZ,40,2014,ALCALDIA,4
4,ALCALDES MUNICIPALES,41254000000003.0,DOMINGUEZ LOPEZ JORGE HUMBERTO,54,2014,ALCALDIA,4
4,ALCALDES MUNICIPALES,41254000000004.0,MORAN VERA OSCAR FRANCISCO,38,2014,ALCALDIA,4
4,ALCALDES MUNICIPALES,41254000000005.0,DUQUE CEDENO FRANCISCO EMILIO,40,2014,ALCALDIA,4
4,ALCALDES MUNICIPALES,41254000000006.0,ALVAREZ RUIZ HILARIO RICARDO,60,2014,ALCALDIA,4
4,ALCALDES MUNICIPALES,41254000000007.0,SALCEDO CANTOS JOHN ROSENDO,45,2014,ALCALDIA,4
4,ALCALDES MUNICIPALES,41254500000001.0,MOSCOL CONTRERAS TEOFILO AGUSTIN,55,2014,ALCALDIA,4
4,ALCALDES MUNICIPALES,41254500000002.0,MUNOZ PILCO JORGE WASHINGTON,36,2014,ALCALDIA,4
4,ALCALDES MUNICIPALES,41254500000003.0,VALDIVIEZO VERA ANA DEL ROSARIO,44,2014,ALCALDIA,4
4,ALCALDES MUNICIPALES,41254500000004.0,SISA PEREIRA JULIO CESAR,59,2014,ALCALDIA,4
4,ALCALDES MUNICIPALES,41254500000005.0,CARRIEL ABAD CARLOS AGAPITO,51,2014,ALCALDIA,4
4,ALCALDES MUNICIPALES,41254500000006.0,VERA ANDRADE MANUEL RAFAEL,58,2014,ALCALDIA,4
4,ALCALDES MUNICIPALES,41254500000007.0,URRUTIA ESPINOZA PATRICIO JAVIER,36,2014,ALCALDIA,4
4,ALCALDES MUNICIPALES,41254600000001.0,BUENANO MURILLO FREDDY FERNANDO,43,2014,ALCALDIA,4
4,ALCALDES MUNICIPALES,41254600000002.0,BASANTES CARDENAS NESTOR EDUARDO,59,2014,ALCALDIA,4
4,ALCALDES MUNICIPALES,41254600000003.0,URIBE ESTRADA LUIS ALBINO,47,2014,ALCALDIA,4
4,ALCALDES MUNICIPALES,41254600000004.0,ALARCON ALARCON NARCIZA DE JESUS,46,2014,ALCALDIA,4
4,ALCALDES MUNICIPALES,41254600000005.0,ALDAZ GONZALEZ CRISTHIAN DANILO,32,2014,ALCALDIA,4
4,ALCALDES MUNICIPALES,41254600000006.0,MANOBANDA MUNOZ PASCUAL BRAULIO,48,2014,ALCALDIA,4
4,ALCALDES MUNICIPALES,41271000000001.0,CORTEZ MARTINEZ ELIFONSO CLEMENTE,53,2014,ALCALDIA,4
4,ALCALDES MUNICIPALES,41271000000002.0,TROYA PACHECO DIGNA AMARILIS,44,2014,ALCALDIA,4
4,ALCALDES MUNICIPALES,41271000000003.0,CAMACHO ESTRADA RONFIS ERNESTO,51,2014,ALCALDIA,4
4,ALCALDES MUNICIPALES,41271000000004.0,AGUILAR SOLIZ OSCAR OSWALDO,51,2014,ALCALDIA,4
4,ALCALDES MUNICIPALES,41275000000001.0,HERRERA ULLON EPIFANIA ISABEL,46,2014,ALCALDIA,4
4,ALCALDES MUNICIPALES,41275000000002.0,ALVAREZ CEDENO LUIS RODOLFO,46,2014,ALCALDIA,4
4,ALCALDES MUNICIPALES,41275000000003.0,ALVAREZ MOSQUERA CLOVIS WELLINGTON,54,2014,ALCALDIA,4
4,ALCALDES MUNICIPALES,41275000000004.0,CHANG HI FONG ALFREDO AMADOR,44,2014,ALCALDIA,4
4,ALCALDES MUNICIPALES,41275000000005.0,LARA MARQUEZ LUIS CAROL,60,2014,ALCALDIA,4
4,ALCALDES MUNICIPALES,41275000000006.0,PIMENTEL KURE FERNANDO JACINTO,42,2014,ALCALDIA,4
4,ALCALDES MUNICIPALES,41275000000007.0,ULLON LOOR ALBERTO VINICIO,33,2014,ALCALDIA,4
4,ALCALDES MUNICIPALES,41275000000008.0,BUSTAMANTE GARCIA JUAN FRANCISCO,44,2014,ALCALDIA,4
4,ALCALDES MUNICIPALES,41294500000001.0,ROSADO ESPINOZA HILTON EUSTAQUIO,52,2014,ALCALDIA,4
4,ALCALDES MUNICIPALES,41294500000002.0,MENDOZA PALMA ERWIN EDUARDO,47,2014,ALCALDIA,4
4,ALCALDES MUNICIPALES,41294500000003.0,JIMENEZ GOMEZ FLEISHMAN MOROSOT,37,2014,ALCALDIA,4
4,ALCALDES MUNICIPALES,41294500000004.0,OLVERA RUIZ FREDDY BORGE,49,2014,ALCALDIA,4
4,ALCALDES MUNICIPALES,41294500000005.0,ZAMBRANO BELLO LUIS RAMON,65,2014,ALCALDIA,4
4,ALCALDES MUNICIPALES,41294600000001.0,ULLON RODRIGUEZ LEANDRO RUFINO,44,2014,ALCALDIA,4
4,ALCALDES MUNICIPALES,41294600000002.0,HOLGUIN GUTIERREZ MARIA CRISTINA,60,2014,ALCALDIA,4
4,ALCALDES MUNICIPALES,41294600000003.0,EGAS AVILES JOFFRE MANUEL,49,2014,ALCALDIA,4
4,ALCALDES MUNICIPALES,41294600000004.0,EGAS OCHOA EDISON DAVID,38,2014,ALCALDIA,4
4,ALCALDES MUNICIPALES,41323000000001.0,INTRIAGO ALCIVAR JAMINTON ENRIQUE,42,2014,ALCALDIA,4
4,ALCALDES MUNICIPALES,41323000000002.0,CEDENO MENDOZA RAMON EDUARDO,44,2014,ALCALDIA,4
4,ALCALDES MUNICIPALES,41323000000003.0,BARREIRO ALCIVAR GIL HUMBERTO,55,2014,ALCALDIA,4
4,ALCALDES MUNICIPALES,41323000000004.0,SOZA SOSA JHONNY LEONEL,22,2014,ALCALDIA,4
4,ALCALDES MUNICIPALES,41344000000001.0,NAVIA MOREIRA IGNACIO ADALBERTO,39,2014,ALCALDIA,4
4,ALCALDES MUNICIPALES,41344000000002.0,MENDOZA FERNANDEZ VERONICA MONSERRATE,41,2014,ALCALDIA,4
4,ALCALDES MUNICIPALES,41344000000003.0,ZAMORA GARCIA MERY SEGUNDA,41,2014,ALCALDIA,4
4,ALCALDES MUNICIPALES,41344000000004.0,LARREA MENDOZA VENANCIO ALFREDO,59,2014,ALCALDIA,4
4,ALCALDES MUNICIPALES,41344000000005.0,VILLARROEL MACIAS CELESTE ELIZABETH,55,2014,ALCALDIA,4
4,ALCALDES MUNICIPALES,41344000000006.0,CANO ZAMBRANO LUIS MAURO,59,2014,ALCALDIA,4
4,ALCALDES MUNICIPALES,41344000000007.0,CASANOVA CEDENO AGUSTIN ELIAS,53,2014,ALCALDIA,4
4,ALCALDES MUNICIPALES,41344000000008.0,ALCIVAR MERA FELIX ANDRES,52,2014,ALCALDIA,4
4,ALCALDES MUNICIPALES,41344000000009.0,CEVALLOS CEVALLOS WALTER ENRIQUE,65,2014,ALCALDIA,4
4,ALCALDES MUNICIPALES,41344500000001.0,LUCAS BAQUE IVAN RAUL,42,2014,ALCALDIA,4
4,ALCALDES MUNICIPALES,41344500000002.0,TORO DELGADO MODESTO CRISTOBAL,54,2014,ALCALDIA,4
4,ALCALDES MUNICIPALES,41344500000003.0,QUIJIJE BAQUE JUAN CARLOS,36,2014,ALCALDIA,4
4,ALCALDES MUNICIPALES,41344500000004.0,DELGADO ALCIVAR JORGE LUIS,41,2014,ALCALDIA,4
4,ALCALDES MUNICIPALES,41344500000005.0,ARTEAGA PALACIOS WILVER WASHINGTON,56,2014,ALCALDIA,4
4,ALCALDES MUNICIPALES,41344500000006.0,QUIJIJE ANCHUNDIA DIOMEDES RICARDO,52,2014,ALCALDIA,4
4,ALCALDES MUNICIPALES,41344500000007.0,CASTILLO FARFAN GIANNA VANESSA,35,2014,ALCALDIA,4
4,ALCALDES MUNICIPALES,41344500000008.0,ESPANA CEDENO MANUEL FLORENCIO,52,2014,ALCALDIA,4
4,ALCALDES MUNICIPALES,41344600000001.0,CARRILLO SANTANA PIO ANTONIO,67,2014,ALCALDIA,4
4,ALCALDES MUNICIPALES,41344600000002.0,CALDERON ALAVA SIMETRIO ARMENGOL,49,2014,ALCALDIA,4
4,ALCALDES MUNICIPALES,41344600000003.0,ARCENTALES MERO FLOWER VALDIMIR,53,2014,ALCALDIA,4
4,ALCALDES MUNICIPALES,41344600000004.0,BAILON PICO BAWER AXDUD,43,2014,ALCALDIA,4
4,ALCALDES MUNICIPALES,41344600000005.0,LOPEZ MEDINA LENIN RODRIGO,44,2014,ALCALDIA,4
4,ALCALDES MUNICIPALES,41344600000006.0,LOPEZ ALONZO DORIS NAIDA,64,2014,ALCALDIA,4
4,ALCALDES MUNICIPALES,41344600000007.0,MONCAYO GARCIA PATRICIA ESTILITA,57,2014,ALCALDIA,4
4,ALCALDES MUNICIPALES,41344600000008.0,ANCHUNDIA DELGADO FABIAN LEONARDO,37,2014,ALCALDIA,4
4,ALCALDES MUNICIPALES,41345000000001.0,CARDENAS ANDRADE LEONARDO,49,2014,ALCALDIA,4
4,ALCALDES MUNICIPALES,41345000000002.0,ZAMBRANO SOLORZANO DE GANDO MARIA MAGDALENA,49,2014,ALCALDIA,4
4,ALCALDES MUNICIPALES,41345000000003.0,ANDRADE ARELLANO SERGIO GUSTAVO,42,2014,ALCALDIA,4
4,ALCALDES MUNICIPALES,41345000000004.0,ZAMBRANO CEDENO JORGE ORLEY,56,2014,ALCALDIA,4
4,ALCALDES MUNICIPALES,41345000000005.0,ESTRADA BONILLA JAIME EDULFO,58,2014,ALCALDIA,4
4,ALCALDES MUNICIPALES,41345000000006.0,ALVIA MENDOZA JUAN CARLOS,41,2014,ALCALDIA,4
4,ALCALDES MUNICIPALES,41345500000001.0,ORLANDO LUCIO DIOMEDES AUGUSTO,57,2014,ALCALDIA,4
4,ALCALDES MUNICIPALES,41345500000002.0,ANDRADE ALMEIDA TEODORO HUMBERTO,47,2014,ALCALDIA,4
4,ALCALDES MUNICIPALES,41345500000003.0,PONCE VACA EDY OMAR,50,2014,ALCALDIA,4
4,ALCALDES MUNICIPALES,41345500000004.0,FALCONI YEPEZ MARCELINO ALBERTO,56,2014,ALCALDIA,4
4,ALCALDES MUNICIPALES,41345500000005.0,CORRAL MOREIRA STALIN GUILLERMO,58,2014,ALCALDIA,4
4,ALCALDES MUNICIPALES,41345500000006.0,CANARTE CANTOS JOAQUIN EDUARDO,62,2014,ALCALDIA,4
4,ALCALDES MUNICIPALES,41345500000007.0,SANCHEZ GUTIERREZ ARMANDO ISIDRO,46,2014,ALCALDIA,4
4,ALCALDES MUNICIPALES,41345500000008.0,ZAVALA GONZALEZ JAIME ARTURO,45,2014,ALCALDIA,4
4,ALCALDES MUNICIPALES,41345500000009.0,MURILLO ACOSTA MIGUEL JOAQUIN,60,2014,ALCALDIA,4
4,ALCALDES MUNICIPALES,41346000000001.0,BAQUEZEA CEDENO IGNACIO ALVARO,66,2014,ALCALDIA,4
4,ALCALDES MUNICIPALES,41346000000002.0,VALERIANO PONCE ELICRO DUVAL,61,2014,ALCALDIA,4
4,ALCALDES MUNICIPALES,41346000000003.0,SOTOMAYOR PEREZ MARIA CONSUELO,27,2014,ALCALDIA,4
4,ALCALDES MUNICIPALES,41346000000004.0,CEDENO BARBERAN RAMON VICENTE,52,2014,ALCALDIA,4
4,ALCALDES MUNICIPALES,41346000000005.0,TOALA RODRIGUEZ BAIRON ARTURO,40,2014,ALCALDIA,4
4,ALCALDES MUNICIPALES,41346000000006.0,SALTOS BARBERAN CIRILO MIGUEL,45,2014,ALCALDIA,4
4,ALCALDES MUNICIPALES,41346500000001.0,ZAMBRANO VACA DIMAS PACIFICO,65,2014,ALCALDIA,4
4,ALCALDES MUNICIPALES,41346500000002.0,BERMUDEZ ABEIGA ALEJANDRO ERNESTO,39,2014,ALCALDIA,4
4,ALCALDES MUNICIPALES,41346500000003.0,ZAMBRANO MACIAS ROQUE PATRICIO,43,2014,ALCALDIA,4
4,ALCALDES MUNICIPALES,41346500000004.0,CEDENO DELGADO RICHAR NARCISO,53,2014,ALCALDIA,4
4,ALCALDES MUNICIPALES,41346500000005.0,LOOR ARTEAGA CELSO NORBERTO,51,2014,ALCALDIA,4
4,ALCALDES MUNICIPALES,41347000000001.0,CEVALLOS SORNOZA ROBERT IVAN,45,2014,ALCALDIA,4
4,ALCALDES MUNICIPALES,41347000000002.0,MIELES MOREIRA ANGEL RICARDO,52,2014,ALCALDIA,4
4,ALCALDES MUNICIPALES,41347000000003.0,MIELES MOREIRA RAMON HERNAN,48,2014,ALCALDIA,4
4,ALCALDES MUNICIPALES,41347000000004.0,FRANCO MARQUEZ HERALDO FLORESMILO,62,2014,ALCALDIA,4
4,ALCALDES MUNICIPALES,41347000000005.0,GARCIA CEDENO WASHINGTON OMAR,54,2014,ALCALDIA,4
4,ALCALDES MUNICIPALES,41347000000006.0,CEDENO ZAMBRANO RAMON FERNANDO,55,2014,ALCALDIA,4
4,ALCALDES MUNICIPALES,41347000000007.0,FORTIS SOLORZANO ANGEL RAFAEL,19,2014,ALCALDIA,4
4,ALCALDES MUNICIPALES,41347500000001.0,CASSIS MARTINEZ FERNANDO ISAAC,62,2014,ALCALDIA,4
4,ALCALDES MUNICIPALES,41347500000002.0,ZAMBRANO ZAMBRANO INGRID JOHANNA,31,2014,ALCALDIA,4
4,ALCALDES MUNICIPALES,41347500000003.0,GILCES MERO MANUEL ANTONIO,39,2014,ALCALDIA,4
