DIGNIDAD_CODIGO,DIGNIDAD_NOMBRE,CANDIDATO_CODIGO,CANDIDATO_NOMBRE,CANDIDATO_EDAD,ANIO,DIGNIDAD_NOMBRE_ESTANDAR,DIGNIDAD_CODIGO_ESTANDAR
4,ALCALDE MUNICIPAL,4062150000001.0,TADAY LEMA JOSE CLEMENTE,36,2004,ALCALDIA,4
4,ALCALDE MUNICIPAL,4062150000002.0,ERAZO NAVARRETE FREDDY PATRICIO,43,2004,ALCALDIA,4
4,ALCALDE MUNICIPAL,4062150000003.0,CATTANI ANDRADE MILTON TRAJANO ANTONIO,49,2004,ALCALDIA,4
4,ALCALDE MUNICIPAL,4062150000004.0,PALACIOS MOLINA WILLIAN ALFREDO,56,2004,ALCALDIA,4
4,ALCALDE MUNICIPAL,4062150000005.0,AZOGUE GUARACA ANGEL ABRAHAN,35,2004,ALCALDIA,4
4,ALCALDE MUNICIPAL,4062200000001.0,QUEZADA PARAMO SERGIO GUSTAVO,41,2004,ALCALDIA,4
4,ALCALDE MUNICIPAL,4062200000002.0,NARVAEZ MANCERO WALTER VICENTE,48,2004,ALCALDIA,4
4,ALCALDE MUNICIPAL,4062200000003.0,SANTANDER SAULA NANCY MARIANA,49,2004,ALCALDIA,4
4,ALCALDE MUNICIPAL,4062200000004.0,FLORES ORDONEZ EUDORO RUPERTO,78,2004,ALCALDIA,4
4,ALCALDE MUNICIPAL,4062200000005.0,RUEDA MEJIA EDGAR HERNAN,48,2004,ALCALDIA,4
4,ALCALDE MUNICIPAL,4062250000001.0,SALAZAR LOPEZ JUAN ALBERTO,38,2004,ALCALDIA,4
4,ALCALDE MUNICIPAL,4062250000002.0,ALVEAR HARO NICOLAS MANUEL,45,2004,ALCALDIA,4
4,ALCALDE MUNICIPAL,4062250000003.0,CHUNATA INCA FAUSTO MIGUEL,52,2004,ALCALDIA,4
4,ALCALDE MUNICIPAL,4062250000004.0,AVENDANO HERRERA FERNANDO OCTAVIO,41,2004,ALCALDIA,4
4,ALCALDE MUNICIPAL,4068300000001.0,PINTO TORRES MILTON ERNESTO,48,2004,ALCALDIA,4
4,ALCALDE MUNICIPAL,4068300000002.0,TORRES LEMA MARCO RAMIRO,31,2004,ALCALDIA,4
4,ALCALDE MUNICIPAL,4068300000003.0,TITO RUILOVA MIGUEL ANGEL,41,2004,ALCALDIA,4
4,ALCALDE MUNICIPAL,4068300000004.0,LEON ASQUI LUIS FERNANDO,47,2004,ALCALDIA,4
4,ALCALDE MUNICIPAL,4068300000005.0,CURICAMA GUAMAN TOMAS NICOLAS,42,2004,ALCALDIA,4
4,ALCALDE MUNICIPAL,4068300000006.0,ROSERO LOZA ABIGAIL DORALIZA,43,2004,ALCALDIA,4
4,ALCALDE MUNICIPAL,4069000000001.0,MEDINA BARROS JAIME EFRAIN,46,2004,ALCALDIA,4
4,ALCALDE MUNICIPAL,4069000000002.0,MOREIRA ZAMBRANO PIEDAD TATIANA,33,2004,ALCALDIA,4
4,ALCALDE MUNICIPAL,4069000000003.0,AVALOS ZAMBRANO JORGE VICENTE,50,2004,ALCALDIA,4
4,ALCALDE MUNICIPAL,4069000000004.0,ESPINOZA CORDERO MILTON EFREN,40,2004,ALCALDIA,4
4,ALCALDE MUNICIPAL,4069000000005.0,YANEZ AMBOYA NESTOR MEDARDO,51,2004,ALCALDIA,4
4,ALCALDE MUNICIPAL,4069000000006.0,HURTADO ORELLANA EDGAR PATRICIO,42,2004,ALCALDIA,4
4,ALCALDE MUNICIPAL,4069000000007.0,BONIFAZ NORIEGA OSWALDO CLEVER,54,2004,ALCALDIA,4
4,ALCALDE MUNICIPAL,4069000000008.0,RODRIGUEZ AVILA PEDRO JIMMY,37,2004,ALCALDIA,4
4,ALCALDE MUNICIPAL,4073500000001.0,LOAIZA ALVAREZ ROSA MARIA,36,2004,ALCALDIA,4
4,ALCALDE MUNICIPAL,4073500000002.0,CORDOVA CORDOVA MARITZA ELIZABETH,31,2004,ALCALDIA,4
4,ALCALDE MUNICIPAL,4073500000003.0,FALQUEZ BATALLAS PEDRO CARLOS,62,2004,ALCALDIA,4
4,ALCALDE MUNICIPAL,4073500000004.0,LARREA GARCIA JORGE WASHINGTON,69,2004,ALCALDIA,4
4,ALCALDE MUNICIPAL,4073500000005.0,MINUCHE MURILLO MARIO ENRIQUE,49,2004,ALCALDIA,4
4,ALCALDE MUNICIPAL,4073500000006.0,ROMERO JIMENEZ FELIX TADEO,49,2004,ALCALDIA,4
4,ALCALDE MUNICIPAL,4073500000007.0,NARANJO ORTEGA VICENTE RAFAEL,45,2004,ALCALDIA,4
4,ALCALDE MUNICIPAL,4073500000008.0,LUDENA DELGADO HECTOR CLODOVEO FELICIANO,40,2004,ALCALDIA,4
4,ALCALDE MUNICIPAL,4073500000009.0,BERRU LEON MANUEL EDUARDO,48,2004,ALCALDIA,4
4,ALCALDE MUNICIPAL,4073550000001.0,NIETO VALAREZO ERNESTO SECUNDINO,66,2004,ALCALDIA,4
4,ALCALDE MUNICIPAL,4073550000002.0,SEGARRA PACHECO JHONNY FERNANDO,48,2004,ALCALDIA,4
4,ALCALDE MUNICIPAL,4073550000003.0,PONTON VALAREZO VICTOR HUGO,49,2004,ALCALDIA,4
4,ALCALDE MUNICIPAL,4073550000004.0,BRAVO RIOFRIO CLEMENTE ESTEBAN,37,2004,ALCALDIA,4
4,ALCALDE MUNICIPAL,4073550000005.0,RUGEL APOLINARIO JOSE DIONICIO,59,2004,ALCALDIA,4
4,ALCALDE MUNICIPAL,4073550000006.0,BLACIO RIVAS ANA UBALDINA,36,2004,ALCALDIA,4
4,ALCALDE MUNICIPAL,4073600000001.0,CASTILLO AGUILAR ERNESTO DANILO,34,2004,ALCALDIA,4
4,ALCALDE MUNICIPAL,4073600000002.0,ROMERO REYES FABIAN GEOVANNY,53,2004,ALCALDIA,4
4,ALCALDE MUNICIPAL,4073600000003.0,ASTUDILLO ORDONEZ NORMAN CLOTARIO,58,2004,ALCALDIA,4
4,ALCALDE MUNICIPAL,4073600000004.0,CARRION ROMERO MANUEL ANTONIO,36,2004,ALCALDIA,4
4,ALCALDE MUNICIPAL,4073600000005.0,MORA MALDONADO JORGE HUGO,46,2004,ALCALDIA,4
4,ALCALDE MUNICIPAL,4073650000001.0,NOBLECILLA ALMEIDA ERASMO ROBERTO,54,2004,ALCALDIA,4
4,ALCALDE MUNICIPAL,4073650000002.0,MERA VERA ABDON MARON,51,2004,ALCALDIA,4
4,ALCALDE MUNICIPAL,4073650000003.0,FARAH FREIRE FELIPE JAVIER,50,2004,ALCALDIA,4
4,ALCALDE MUNICIPAL,4073650000004.0,GARCIA IZURIETA IRLANDA ALISVA,47,2004,ALCALDIA,4
4,ALCALDE MUNICIPAL,4073650000005.0,SERRANO NOBLECILLA KURTS FULTON,39,2004,ALCALDIA,4
4,ALCALDE MUNICIPAL,4073650000006.0,CAJAMARCA PONCE GALO VINICIO,37,2004,ALCALDIA,4
4,ALCALDE MUNICIPAL,4073650000007.0,VACA ORAMAS ROSARIO DEL CARMEN,43,2004,ALCALDIA,4
4,ALCALDE MUNICIPAL,4073650000008.0,COBOS ARMIJOS RENEE RICARDO,46,2004,ALCALDIA,4
4,ALCALDE MUNICIPAL,4073650000009.0,ARMIJOS CAPA VICTOR MANUEL,41,2004,ALCALDIA,4
4,ALCALDE MUNICIPAL,4073700000001.0,LOAYZA ROMERO LUCIO BOLIVAR,52,2004,ALCALDIA,4
4,ALCALDE MUNICIPAL,4073700000002.0,ABARCA RENTERIA HITLER ARMINIO,56,2004,ALCALDIA,4
4,ALCALDE MUNICIPAL,4073700000003.0,ROMERO ANAZCO  WASHINGTON MANRIQUE,38,2004,ALCALDIA,4
4,ALCALDE MUNICIPAL,4073700000004.0,GRANDA ROMERO JAIME WILSON,45,2004,ALCALDIA,4
4,ALCALDE MUNICIPAL,4073700000005.0,CUEVA GONZALEZ JOSEPH WILTON,34,2004,ALCALDIA,4
4,ALCALDE MUNICIPAL,4073700000006.0,RIOFRIO MURILLO MIGUEL ANGEL MARCELO,55,2004,ALCALDIA,4
4,ALCALDE MUNICIPAL,4073750000001.0,JARAMILLO HIDALGO WILSON LUCIANO,46,2004,ALCALDIA,4
4,ALCALDE MUNICIPAL,4073750000002.0,JIMENEZ CASTILLO FRANKLIN EDUARDO,40,2004,ALCALDIA,4
4,ALCALDE MUNICIPAL,4073750000003.0,POGO LOAYZA LUIS BERNARDO,58,2004,ALCALDIA,4
4,ALCALDE MUNICIPAL,4073750000004.0,SANCHEZ ANDRADE CHANENA LUCINDA,44,2004,ALCALDIA,4
4,ALCALDE MUNICIPAL,4073750000005.0,SANCHEZ PINEDA LUIS ALFONSO,54,2004,ALCALDIA,4
4,ALCALDE MUNICIPAL,4073750000006.0,TORRES TORRES RITA KARINA,30,2004,ALCALDIA,4
4,ALCALDE MUNICIPAL,4073750000007.0,CHERRES JHON CESAR,55,2004,ALCALDIA,4
4,ALCALDE MUNICIPAL,4073750000008.0,ROMERO TINITANA LIVIO RAMON,49,2004,ALCALDIA,4
4,ALCALDE MUNICIPAL,4073750000009.0,GONZALEZ ASTUDILLO KLEBER OSWALDO,37,2004,ALCALDIA,4
4,ALCALDE MUNICIPAL,4073800000001.0,INTRIAGO MENDOZA NEWTON MAURICIO,45,2004,ALCALDIA,4
4,ALCALDE MUNICIPAL,4073800000002.0,NIVELO NIEVES LOURDES LORENA,31,2004,ALCALDIA,4
4,ALCALDE MUNICIPAL,4073800000003.0,SERRANO CARRION MANUEL GUILLERMO ENRIQUE,41,2004,ALCALDIA,4
4,ALCALDE MUNICIPAL,4073800000004.0,SALAZAR CASTRO ABRAHAN DANILO,45,2004,ALCALDIA,4
4,ALCALDE MUNICIPAL,4073800000005.0,MACHUCA ORELLANA MERCEDES MARIANITA,42,2004,ALCALDIA,4
4,ALCALDE MUNICIPAL,4073800000006.0,FAREZ ARCINIEGA  DIANA FRANCISCA,38,2004,ALCALDIA,4
4,ALCALDE MUNICIPAL,4075850000001.0,FAJARDO TITUANA MARIANO MARINO,44,2004,ALCALDIA,4
4,ALCALDE MUNICIPAL,4075850000002.0,NAGUA COJITAMBO VICTOR ALCIDES,69,2004,ALCALDIA,4
4,ALCALDE MUNICIPAL,4075850000003.0,GUANUCHE NAGUA VICTOR CLOTARIO,57,2004,ALCALDIA,4
4,ALCALDE MUNICIPAL,4076900000001.0,ESPINOSA MACAS CARLOS ENRIQUE,45,2004,ALCALDIA,4
4,ALCALDE MUNICIPAL,4076900000002.0,ORELLANA ESPEJO SEGUNDO EUGENIO,40,2004,ALCALDIA,4
4,ALCALDE MUNICIPAL,4076900000003.0,ROMERO ORELLANA JULIO BOLIVAR,43,2004,ALCALDIA,4
4,ALCALDE MUNICIPAL,4076950000001.0,ZHUNIOR MALLA RUBEN EUDOFILIO,48,2004,ALCALDIA,4
4,ALCALDE MUNICIPAL,4076950000002.0,AGUIRRE PIEDRA MANUEL IGNACIO,51,2004,ALCALDIA,4
4,ALCALDE MUNICIPAL,4076950000003.0,CUEVA RODRIGUEZ FRANCO WASHINGTON ASDRUBAL,58,2004,ALCALDIA,4
4,ALCALDE MUNICIPAL,4076950000004.0,ROSERO QUIROZ SAULO PATRICIO,49,2004,ALCALDIA,4
4,ALCALDE MUNICIPAL,4076950000005.0,AGUILAR OCHOA VICENTE AMABLE,31,2004,ALCALDIA,4
4,ALCALDE MUNICIPAL,4077050000001.0,RUILOVA TINOCO JORGE JOSE ALCIVIADES,42,2004,ALCALDIA,4
4,ALCALDE MUNICIPAL,4077050000002.0,QUEZADA PEREZ EXAR VALERIANO,42,2004,ALCALDIA,4
4,ALCALDE MUNICIPAL,4077550000001.0,BUSTAMANTE GRANDA ASDRUBAL,48,2004,ALCALDIA,4
4,ALCALDE MUNICIPAL,4077550000002.0,GONZALEZ ESPINOZA ENRIQUE ANIVAL,55,2004,ALCALDIA,4
4,ALCALDE MUNICIPAL,4077550000003.0,CHAMBA REVILLA ANGEL ROSALINO,45,2004,ALCALDIA,4
4,ALCALDE MUNICIPAL,4078600000001.0,APOLO RAMIREZ HUGO MARIO,47,2004,ALCALDIA,4
4,ALCALDE MUNICIPAL,4078600000002.0,CALOZUMA ARMIJOS EFREN ESCOBAR,44,2004,ALCALDIA,4
4,ALCALDE MUNICIPAL,4078600000003.0,VALAREZO AGUILAR GALO BOLIVAR,47,2004,ALCALDIA,4
4,ALCALDE MUNICIPAL,4078600000004.0,SOTO CARDENAS JAIME FLORIBERTO,45,2004,ALCALDIA,4
4,ALCALDE MUNICIPAL,4078600000005.0,ANAZCO APOLO BOLIVAR GUILLERMO,53,2004,ALCALDIA,4
4,ALCALDE MUNICIPAL,4078600000006.0,AGUILAR ATIENCIE URBANO DE JESUS,41,2004,ALCALDIA,4
4,ALCALDE MUNICIPAL,4078600000007.0,MALDONADO REYES EMERITO DE JESUS,45,2004,ALCALDIA,4
4,ALCALDE MUNICIPAL,4078750000001.0,PINTO RAMIREZ MANUEL ANDRES,44,2004,ALCALDIA,4
4,ALCALDE MUNICIPAL,4078750000002.0,APOLO LAOYZA MARIA LUISA,40,2004,ALCALDIA,4
4,ALCALDE MUNICIPAL,4078750000003.0,VALAREZO BRAVO ANGEL POLIBIO,57,2004,ALCALDIA,4
4,ALCALDE MUNICIPAL,4078750000004.0,JARAMILLO PALACIOS DIONICIO FERNANDO,59,2004,ALCALDIA,4
4,ALCALDE MUNICIPAL,4078750000005.0,ASANZA ROMERO VICTOR MANUEL,42,2004,ALCALDIA,4
4,ALCALDE MUNICIPAL,4078750000006.0,GALARZA ASANZA GUIDO GERARDO,55,2004,ALCALDIA,4
4,ALCALDE MUNICIPAL,4078750000007.0,GALLARDO RAMIREZ JOSE PACIFICO,54,2004,ALCALDIA,4
4,ALCALDE MUNICIPAL,4078750000008.0,UCHUARI APOLO PACIFICA DEL CARMEN,51,2004,ALCALDIA,4
4,ALCALDE MUNICIPAL,4078750000009.0,PIEDRA ARMIJOS MANUEL ANIBAL,56,2004,ALCALDIA,4
4,ALCALDE MUNICIPAL,4085600000001.0,CAICEDO PLATA  MIGUEL,50,2004,ALCALDIA,4
4,ALCALDE MUNICIPAL,4085600000002.0,QUINONEZ QUINTERO  NILZON,45,2004,ALCALDIA,4
4,ALCALDE MUNICIPAL,4085600000003.0,JAUCH CAICEDO DINA YADIRA,47,2004,ALCALDIA,4
4,ALCALDE MUNICIPAL,4085600000004.0,CANIZARES CANOTE CARLOS CESAR,45,2004,ALCALDIA,4
4,ALCALDE MUNICIPAL,4085600000005.0,VALENCIA VALENCIA FAUSTIN ELIAS,55,2004,ALCALDIA,4
4,ALCALDE MUNICIPAL,4085600000006.0,ESTUPINAN QUINTERO ERNESTO ALONSO,47,2004,ALCALDIA,4
4,ALCALDE MUNICIPAL,4085610000001.0,VERA FIGUEROA MANUEL VICENTE,45,2004,ALCALDIA,4
4,ALCALDE MUNICIPAL,4085610000002.0,LOPEZ SAUD BORIS PAUL,42,2004,ALCALDIA,4
4,ALCALDE MUNICIPAL,4085610000003.0,LEMOS PACHECO JESUS BENJAMIN,43,2004,ALCALDIA,4
4,ALCALDE MUNICIPAL,4085610000004.0,VERA ESTUPINAN CARLOS JULIO,44,2004,ALCALDIA,4
4,ALCALDE MUNICIPAL,4085650000001.0,COIME MOSQUERA EDUARDO ANIBAL,43,2004,ALCALDIA,4
4,ALCALDE MUNICIPAL,4085650000002.0,REASCO ARAGON  HOWISWIS,38,2004,ALCALDIA,4
4,ALCALDE MUNICIPAL,4085650000003.0,RIVERA BUSTO DELFIDA,43,2004,ALCALDIA,4
4,ALCALDE MUNICIPAL,4085650000004.0,LUQUE SEVILLA FAUSTO LEOPOLDO,47,2004,ALCALDIA,4
4,ALCALDE MUNICIPAL,4085650000005.0,MINA VERNAZA RICHARD,45,2004,ALCALDIA,4
4,ALCALDE MUNICIPAL,4085650000006.0,PANCHANO MIDEROS RAUL MANUEL,35,2004,ALCALDIA,4
4,ALCALDE MUNICIPAL,4085650000007.0,PORTOCARRERO ZURITA ANTONIO NAPOLEON,37,2004,ALCALDIA,4
4,ALCALDE MUNICIPAL,4085700000001.0,QUINTERO VERA TAIRON IVAN,33,2004,ALCALDIA,4
4,ALCALDE MUNICIPAL,4085700000002.0,MONTESDEOCA CHILA JUAN OSWALDO,38,2004,ALCALDIA,4
4,ALCALDE MUNICIPAL,4085700000003.0,COLORADO POZO SIMON CESAR,37,2004,ALCALDIA,4
4,ALCALDE MUNICIPAL,4085700000004.0,TELLO VELEZ GUIDO ANTONIO,42,2004,ALCALDIA,4
4,ALCALDE MUNICIPAL,4085700000005.0,FERRIN BARBERAN RICARDO IVAN,49,2004,ALCALDIA,4
4,ALCALDE MUNICIPAL,4085700000006.0,SOSA PEREZ JOSE EDUARDO,47,2004,ALCALDIA,4
4,ALCALDE MUNICIPAL,4085700000007.0,ORAMAS QUINTERO ERNESTO MIGUEL,44,2004,ALCALDIA,4
4,ALCALDE MUNICIPAL,4085700000008.0,MERINO MANCHENO FAUSTO EMILIO ROMULO,63,2004,ALCALDIA,4
4,ALCALDE MUNICIPAL,4085700000009.0,CASTRO ROJAS GUILFORD SIMON,55,2004,ALCALDIA,4
4,ALCALDE MUNICIPAL,4085700000010.0,VERA GUERRERO EDDI WALQUER,33,2004,ALCALDIA,4
4,ALCALDE MUNICIPAL,4085750000001.0,QUIJIJE LOOR  ZOILA ROSA,34,2004,ALCALDIA,4
4,ALCALDE MUNICIPAL,4085750000002.0,BARCIA MOLINA CARLOS SIMON,40,2004,ALCALDIA,4
4,ALCALDE MUNICIPAL,4085750000003.0,LOPEZ REASCOS  LUDWIN PATRICIO,40,2004,ALCALDIA,4
4,ALCALDE MUNICIPAL,4085750000004.0,CHIMBAY QUINTUNA JUAN EZEQUIEL,62,2004,ALCALDIA,4
4,ALCALDE MUNICIPAL,4085750000005.0,HARO HARO  CORNELIO MIGUEL,53,2004,ALCALDIA,4
4,ALCALDE MUNICIPAL,4085800000001.0,CABEZA ORTIZ JORGE ANDRES,40,2004,ALCALDIA,4
4,ALCALDE MUNICIPAL,4085800000002.0,QUINONEZ RAMIREZ WILSON NOLBERTO,41,2004,ALCALDIA,4
4,ALCALDE MUNICIPAL,4085800000003.0,QUINTERO VALENCIA DOMINGO MARCIS,50,2004,ALCALDIA,4
4,ALCALDE MUNICIPAL,4085800000004.0,VALENCIA ALARCON LUIS ENRIQUE,39,2004,ALCALDIA,4
4,ALCALDE MUNICIPAL,4085800000005.0,SAMANIEGO OCHOA GUSTAVO ELEODORO,31,2004,ALCALDIA,4
4,ALCALDE MUNICIPAL,4085800000006.0,BRAVO ESTERILLA WASHINGTON LUIS ONIL,42,2004,ALCALDIA,4
4,ALCALDE MUNICIPAL,4085800000007.0,NAZARENO VIVERO SEGUNDO PAULINO,46,2004,ALCALDIA,4
4,ALCALDE MUNICIPAL,4085800000008.0,RUIZ SANTAMARIA  CARLOS HUMBERTO,76,2004,ALCALDIA,4
4,ALCALDE MUNICIPAL,4085800000009.0,GAMBOA REQUENE GANDHY GASPAR,34,2004,ALCALDIA,4
4,ALCALDE MUNICIPAL,4087850000001.0,MOREIRA VELEZ GERARDO ALFREDO,59,2004,ALCALDIA,4
4,ALCALDE MUNICIPAL,4087850000002.0,CASTILLO BAILON HENRY ALBERTO,37,2004,ALCALDIA,4
4,ALCALDE MUNICIPAL,4087850000003.0,SALDARRIAGA CORRAL FREDY GONZALO,39,2004,ALCALDIA,4
4,ALCALDE MUNICIPAL,4087850000004.0,GUARNIZO VERDESOTO MARIA FRANCISCA,45,2004,ALCALDIA,4
4,ALCALDE MUNICIPAL,4087850000005.0,APARICIO MORCILLO DICK DOVIER,57,2004,ALCALDIA,4
4,ALCALDE MUNICIPAL,4087850000006.0,LOAYZA ICAZA  JAIME DANIEL,47,2004,ALCALDIA,4
4,ALCALDE MUNICIPAL,4090950000001.0,ALVAREZ ROMERO  MIGUEL ANGEL,62,2004,ALCALDIA,4
4,ALCALDE MUNICIPAL,4090950000002.0,ASTUDILLO NIEMES FELIPE ROGELIO,64,2004,ALCALDIA,4
4,ALCALDE MUNICIPAL,4090950000003.0,ALAVA PANCHANA HUMBERTO FRANCISCO,47,2004,ALCALDIA,4
4,ALCALDE MUNICIPAL,4090950000004.0,CHICA GUTIERREZ GLEN ROBERT,40,2004,ALCALDIA,4
4,ALCALDE MUNICIPAL,4090950000005.0,MARTILLO LANDIVAR LISIMACO AQUILINO,56,2004,ALCALDIA,4
4,ALCALDE MUNICIPAL,4090950000006.0,TENEMPAGUAY QUINTUNA CARLOS ALBERTO,34,2004,ALCALDIA,4
4,ALCALDE MUNICIPAL,4090950000007.0,MOLINA JARAMILLO MARIO EDUARDO,45,2004,ALCALDIA,4
4,ALCALDE MUNICIPAL,4091250000001.0,CARBO MEDINA  CRISTINA ARACELI,69,2004,ALCALDIA,4
4,ALCALDE MUNICIPAL,4091250000002.0,PRADO PRADO UBER AMADOR,31,2004,ALCALDIA,4
4,ALCALDE MUNICIPAL,4091250000003.0,VALENCIA CABRERA WILSON EDILBERTO,49,2004,ALCALDIA,4
4,ALCALDE MUNICIPAL,4091250000004.0,SANTISTEVAN BAYAS ADOLFO RAFAEL,72,2004,ALCALDIA,4
4,ALCALDE MUNICIPAL,4091250000005.0,QUIJIJE TRIVINO WALTER ENRIQUE,43,2004,ALCALDIA,4
4,ALCALDE MUNICIPAL,4091250000006.0,GARCIA FRANCO CESAR ENRIQUE,55,2004,ALCALDIA,4
4,ALCALDE MUNICIPAL,4091250000007.0,SOLORZANO ZAVALA LUIS ALFREDO,47,2004,ALCALDIA,4
4,ALCALDE MUNICIPAL,4093850000001.0,ALONZO MORA CESAR RICARDO,38,2004,ALCALDIA,4
4,ALCALDE MUNICIPAL,4093850000002.0,PINARGOTE BORJA  DANIEL ALFONSO,61,2004,ALCALDIA,4
4,ALCALDE MUNICIPAL,4093850000003.0,ALAVA SABANDO WASHINGTON ANTONIO,41,2004,ALCALDIA,4
4,ALCALDE MUNICIPAL,4093850000004.0,VELEZ BAILON OSWALDO NARCISO,48,2004,ALCALDIA,4
4,ALCALDE MUNICIPAL,4093850000005.0,GANCHOZO ZAMBRANO CARLOS HENRY,45,2004,ALCALDIA,4
4,ALCALDE MUNICIPAL,4093850000006.0,VINCES SANTOS WILSON ELIESER,44,2004,ALCALDIA,4
4,ALCALDE MUNICIPAL,4093900000001.0,MANTILLA HUERTA  LUIS FELIPE,54,2004,ALCALDIA,4
4,ALCALDE MUNICIPAL,4093900000002.0,NEBOT SAADI JAIME JOSE,57,2004,ALCALDIA,4
4,ALCALDE MUNICIPAL,4093900000003.0,BARRENO ZAMBRANO KIKO FERNANDO,32,2004,ALCALDIA,4
4,ALCALDE MUNICIPAL,4093900000004.0,JAIRALA VALLAZZA JAIME ANTONIO,47,2004,ALCALDIA,4
4,ALCALDE MUNICIPAL,4093900000005.0,MORENO SILVA ARACELLY MAGDALENA,56,2004,ALCALDIA,4
4,ALCALDE MUNICIPAL,4093900000006.0,PIN GUERRERO GABRIEL ELOY,52,2004,ALCALDIA,4
4,ALCALDE MUNICIPAL,4093900000007.0,FARRA ALVARADO JOSE MUNIR,52,2004,ALCALDIA,4
4,ALCALDE MUNICIPAL,4093900000008.0,LATORRE SALAZAR MARIO FERNANDO,40,2004,ALCALDIA,4
4,ALCALDE MUNICIPAL,4093950000001.0,SALAZAR BARZOLA  EDUARDO REINALDO,40,2004,ALCALDIA,4
4,ALCALDE MUNICIPAL,4093950000002.0,AGUILAR JIMENEZ JOSE ANTONIO,52,2004,ALCALDIA,4
4,ALCALDE MUNICIPAL,4093950000003.0,CADENA MARIDUENA JANET NARCISA,45,2004,ALCALDIA,4
4,ALCALDE MUNICIPAL,4093950000004.0,ROMERO CABRERA CRISTOBAL ALBERTO,40,2004,ALCALDIA,4
4,ALCALDE MUNICIPAL,4093950000005.0,GARCIA JIMENEZ FLAVIO AGUSTIN,52,2004,ALCALDIA,4
4,ALCALDE MUNICIPAL,4093950000006.0,YUQUILEMA CARRILLO ANGEL RUBEN,44,2004,ALCALDIA,4
4,ALCALDE MUNICIPAL,4093950000007.0,CANTILLO GOROTIZA FRANCISCO ESTEBAN,65,2004,ALCALDIA,4
4,ALCALDE MUNICIPAL,4093950000008.0,CALDERON RAMIREZ HENDRIK FEDERICO,30,2004,ALCALDIA,4
4,ALCALDE MUNICIPAL,4094000000001.0,HIDALGO ALVARADO RAUL TEODORO,43,2004,ALCALDIA,4
4,ALCALDE MUNICIPAL,4094000000002.0,SALAZAR BARZOLA PEDRO OTTON,58,2004,ALCALDIA,4
4,ALCALDE MUNICIPAL,4094000000003.0,RONQUILLO NAVARRETE NELSON ALES,46,2004,ALCALDIA,4
4,ALCALDE MUNICIPAL,4094000000004.0,RIVAS CEREZO FELIX MARCIAL,57,2004,ALCALDIA,4
4,ALCALDE MUNICIPAL,4094000000005.0,PAVA SAGBAY EDGAR SIELITO,49,2004,ALCALDIA,4
4,ALCALDE MUNICIPAL,4094000000006.0,MEJIA ALVARADO INES SECUNDINA,47,2004,ALCALDIA,4
4,ALCALDE MUNICIPAL,4094050000001.0,MACCHIAVELLO FABARA JORGE LUIS,42,2004,ALCALDIA,4
4,ALCALDE MUNICIPAL,4094050000002.0,BORBOR MITE VICENTE PAUL,39,2004,ALCALDIA,4
4,ALCALDE MUNICIPAL,4094050000003.0,YAGUAL VILLALTA GALO VINICIO,44,2004,ALCALDIA,4
4,ALCALDE MUNICIPAL,4094050000004.0,MOLINA PALACIOS EDWIN JAVIER,38,2004,ALCALDIA,4
4,ALCALDE MUNICIPAL,4094050000005.0,CASTRO DAGER GUILLERMO ANTONIO,52,2004,ALCALDIA,4
4,ALCALDE MUNICIPAL,4094050000006.0,SUAREZ MANZANO APOLO FERNANDO,44,2004,ALCALDIA,4
4,ALCALDE MUNICIPAL,4094050000007.0,CHALEN RODRIGUEZ SARA JACINTA,36,2004,ALCALDIA,4
4,ALCALDE MUNICIPAL,4094050000008.0,DEL PEZO TIGRERO JULIO ALEJANDRO,56,2004,ALCALDIA,4
4,ALCALDE MUNICIPAL,4094050000009.0,CADENA CASTILLO LUIS EDUARDO,56,2004,ALCALDIA,4
4,ALCALDE MUNICIPAL,4094100000001.0,LAINEZ VERA  NORBERTO WILLIAM,39,2004,ALCALDIA,4
4,ALCALDE MUNICIPAL,4094100000002.0,GELLIBERT LARRETA WALTER RICARDO,68,2004,ALCALDIA,4
4,ALCALDE MUNICIPAL,4094100000003.0,MEDINA DOMINGUEZ EFRAIN KLEBER,62,2004,ALCALDIA,4
4,ALCALDE MUNICIPAL,4094100000004.0,CANDELL SOTO ENRIQUE JIMMY,47,2004,ALCALDIA,4
4,ALCALDE MUNICIPAL,4094100000005.0,REYES VILLAO EFRAIN PEDRO,54,2004,ALCALDIA,4
4,ALCALDE MUNICIPAL,4094100000006.0,GONZABAY SALINAS DIONICIO ROMAN,46,2004,ALCALDIA,4
4,ALCALDE MUNICIPAL,4094100000007.0,LAINEZ CABEZAS ELISA MARIA,56,2004,ALCALDIA,4
4,ALCALDE MUNICIPAL,4094100000008.0,MENDOZA COBENA MARIA MAGDALENA,54,2004,ALCALDIA,4
4,ALCALDE MUNICIPAL,4094100000009.0,JUPITER GUTIERREZ SILVIO HERIBERTO,37,2004,ALCALDIA,4
4,ALCALDE MUNICIPAL,4094100000010.0,QUIRUMBAY ORRALA JOSE DOLORES,53,2004,ALCALDIA,4
4,ALCALDE MUNICIPAL,4094150000001.0,PLAZA ORMAZA  LUIS ARTURO,37,2004,ALCALDIA,4
4,ALCALDE MUNICIPAL,4094150000002.0,MACIAS GUERRA PEDRO JUAN,55,2004,ALCALDIA,4
4,ALCALDE MUNICIPAL,4094150000003.0,AGUAYO DELGADO ALEJO RAFAEL,53,2004,ALCALDIA,4
4,ALCALDE MUNICIPAL,4094150000004.0,TRIVINO RODRIGUEZ FRANKLIN ALEJANDRO,57,2004,ALCALDIA,4
4,ALCALDE MUNICIPAL,4094150000005.0,GONZALES  TOMALA CIRILO G,44,2004,ALCALDIA,4
4,ALCALDE MUNICIPAL,4094150000006.0,QUINTERO ROSADO RAUL AUGUSTO,50,2004,ALCALDIA,4
4,ALCALDE MUNICIPAL,4094200000001.0,ANDRADE ORTEGA  LISTER NELSON,59,2004,ALCALDIA,4
4,ALCALDE MUNICIPAL,4094200000002.0,GONZABAY CEVALLOS OSCAR EFRAIN,49,2004,ALCALDIA,4
4,ALCALDE MUNICIPAL,4094200000003.0,NEIRA VICUNA ROSA VICTORIA,50,2004,ALCALDIA,4
4,ALCALDE MUNICIPAL,4094200000004.0,ASAN WONSANG JOSE FRANCISCO,52,2004,ALCALDIA,4
4,ALCALDE MUNICIPAL,4094200000005.0,ENRIQUEZ ESCALANTE LUCILO,58,2004,ALCALDIA,4
4,ALCALDE MUNICIPAL,4094200000006.0,SARZOSA NARANJO WILLIAMS FERNANDO,31,2004,ALCALDIA,4
4,ALCALDE MUNICIPAL,4094200000007.0,MARTINEZ BARBOTOA RENSO ECUADOR,32,2004,ALCALDIA,4
4,ALCALDE MUNICIPAL,4094250000001.0,RODRIGUEZ ROMERO  MERYS ELENA,39,2004,ALCALDIA,4
4,ALCALDE MUNICIPAL,4094250000002.0,YUNEZ PARRA JOSE MIGUEL,45,2004,ALCALDIA,4
4,ALCALDE MUNICIPAL,4094250000003.0,NAVARRO RIPALDA OSWALDO FRANCISCO,47,2004,ALCALDIA,4
4,ALCALDE MUNICIPAL,4094250000004.0,CALDERON MONCADA FRANKLIN JACINTO,46,2004,ALCALDIA,4
4,ALCALDE MUNICIPAL,4094300000001.0,PILOZO SANCHEZ  VICENTE DEGODE,46,2004,ALCALDIA,4
4,ALCALDE MUNICIPAL,4094300000002.0,ALFARO MIELES JULIO OLMEDO,42,2004,ALCALDIA,4
4,ALCALDE MUNICIPAL,4094300000003.0,GALLARDO VARGAS EDY ROSENDO,36,2004,ALCALDIA,4
4,ALCALDE MUNICIPAL,4094300000004.0,SANCHEZ ROMERO  GASTON GABRIEL,57,2004,ALCALDIA,4
4,ALCALDE MUNICIPAL,4094300000005.0,PALMA LOPEZ LUIS AUGUSTO,54,2004,ALCALDIA,4
4,ALCALDE MUNICIPAL,4094300000006.0,VERA FABRE HECTOR JUAN CARLOS,50,2004,ALCALDIA,4
4,ALCALDE MUNICIPAL,4094350000001.0,CHIMBO LLIVICHUZHCA WILIAN ALBERTO,35,2004,ALCALDIA,4
4,ALCALDE MUNICIPAL,4094350000002.0,SUAREZ SANCHEZ JOFFRE ROBERTO,50,2004,ALCALDIA,4
4,ALCALDE MUNICIPAL,4094350000003.0,LAM ARBOLEDA  GENARO SEGUNDO,59,2004,ALCALDIA,4
4,ALCALDE MUNICIPAL,4094350000004.0,ESPINOZA RIVAS RUPERTO JUVENCIO,58,2004,ALCALDIA,4
4,ALCALDE MUNICIPAL,4094350000005.0,CORONEL VELIZ WILLAN EULALIO,41,2004,ALCALDIA,4
4,ALCALDE MUNICIPAL,4094350000006.0,DAU OCHOA JOSE ANTONIO,61,2004,ALCALDIA,4
4,ALCALDE MUNICIPAL,4094350000007.0,PENAFIEL PENAFIEL FELIX JOEL,54,2004,ALCALDIA,4
4,ALCALDE MUNICIPAL,4094350000008.0,ENRIQUEZ VASQUEZ MARCO TULIO,50,2004,ALCALDIA,4
4,ALCALDE MUNICIPAL,4095050000001.0,FEICAN CONDO CESAR ANTONIO,54,2004,ALCALDIA,4
4,ALCALDE MUNICIPAL,4095050000002.0,MARTILLO PINO JOSE DAVID,52,2004,ALCALDIA,4
4,ALCALDE MUNICIPAL,4095050000003.0,GALLEGOS LOPEZ  GLADYS JOSEFINA,44,2004,ALCALDIA,4
4,ALCALDE MUNICIPAL,4095050000004.0,VARGAS MURILLO BELLA ORLANDA,52,2004,ALCALDIA,4
4,ALCALDE MUNICIPAL,4095050000005.0,BARRAGAN MINO GALO,56,2004,ALCALDIA,4
4,ALCALDE MUNICIPAL,4095100000001.0,PEREZ MEDINA  NELSON ELVIS,42,2004,ALCALDIA,4
4,ALCALDE MUNICIPAL,4095100000002.0,PARRALES ORTIZ JOSE ANGEL BENARDINO,67,2004,ALCALDIA,4
4,ALCALDE MUNICIPAL,4095100000003.0,BETANCOURTH VALAREZO MAXIMO DAVID,43,2004,ALCALDIA,4
4,ALCALDE MUNICIPAL,4095100000004.0,VASQUEZ MURILLO LORENZO HIPOLITO,59,2004,ALCALDIA,4
4,ALCALDE MUNICIPAL,4095100000005.0,CRESPO VILLALTA LUIS EDUARDO,37,2004,ALCALDIA,4
4,ALCALDE MUNICIPAL,4095100000006.0,BACUY BOLANOS GERMAN OSWALDO,50,2004,ALCALDIA,4
4,ALCALDE MUNICIPAL,4095100000007.0,MOLINA ONCE LUIS RIGOBERTO,48,2004,ALCALDIA,4
4,ALCALDE MUNICIPAL,4096750000001.0,GOYA VILLACIS ROMULO ALFREDO,58,2004,ALCALDIA,4
4,ALCALDE MUNICIPAL,4096750000002.0,ALCIVAR ARAUJO MIRIAM JANETT,45,2004,ALCALDIA,4
4,ALCALDE MUNICIPAL,4096750000003.0,OLVERA OLVERA CARLOS ALBERTO,56,2004,ALCALDIA,4
4,ALCALDE MUNICIPAL,4096750000004.0,TAPIA VELEZ LUIS GILBERTO,43,2004,ALCALDIA,4
4,ALCALDE MUNICIPAL,4096750000005.0,TRIVINO ZAMBRANO WASHINGTON OLMEDO,53,2004,ALCALDIA,4
4,ALCALDE MUNICIPAL,4096750000006.0,GOYA CEREZO MANUEL HUMBERTO,43,2004,ALCALDIA,4
4,ALCALDE MUNICIPAL,4096750000007.0,NELSON ARNOLDO GOYA CASTRO,51,2004,ALCALDIA,4
4,ALCALDE MUNICIPAL,4097150000001.0,CHAMBA SOLANO VICTOR EDUARDO,41,2004,ALCALDIA,4
4,ALCALDE MUNICIPAL,4097150000002.0,ORTIZ DECIMAVILLA JENNY FELICITA,40,2004,ALCALDIA,4
4,ALCALDE MUNICIPAL,4097150000003.0,LOPEZ MARTINEZ GERMANIA GENOVEVA,54,2004,ALCALDIA,4
4,ALCALDE MUNICIPAL,4097150000004.0,GARAY MARTILLO FRANCISCO JAVIER,37,2004,ALCALDIA,4
4,ALCALDE MUNICIPAL,4097150000005.0,BAJANA SUAREZ JORGE LUIS,48,2004,ALCALDIA,4
4,ALCALDE MUNICIPAL,4097150000006.0,GOMEZ SALAZAR XAVIER MARTINO,39,2004,ALCALDIA,4
4,ALCALDE MUNICIPAL,4097150000007.0,HOLGUIN LOPEZ WINSTON ARTEMIO,37,2004,ALCALDIA,4
4,ALCALDE MUNICIPAL,4097150000008.0,ESPINOZA FIGUEROA EDUARDO CLEMENTE,48,2004,ALCALDIA,4
4,ALCALDE MUNICIPAL,4097150000009.0,VIDAL TABARES  MARIA ORFELINA,57,2004,ALCALDIA,4
4,ALCALDE MUNICIPAL,4097150000010.0,TRIANA LIMA EVARISTO EDUARDO,48,2004,ALCALDIA,4
4,ALCALDE MUNICIPAL,4097350000001.0,SANCHEZ VERA JORGE IBAN,39,2004,ALCALDIA,4
4,ALCALDE MUNICIPAL,4097350000002.0,AMADOR PALMA ANGELA PILAR,57,2004,ALCALDIA,4
4,ALCALDE MUNICIPAL,4097350000003.0,CASSANELLO CASSANELLO LAWRENCE LUIS,54,2004,ALCALDIA,4
4,ALCALDE MUNICIPAL,4097350000004.0,VEGA GERMAN LUIS EDUARDO,49,2004,ALCALDIA,4
4,ALCALDE MUNICIPAL,4097350000005.0,CORREA VASCO  JOSE RODRIGO,49,2004,ALCALDIA,4
4,ALCALDE MUNICIPAL,4097350000006.0,APOLINARIO CAMINO WILLIAM RAFAEL,48,2004,ALCALDIA,4
4,ALCALDE MUNICIPAL,4097350000007.0,YAGUAL GONZALEZ ARMANDO,63,2004,ALCALDIA,4
4,ALCALDE MUNICIPAL,4097350000008.0,MARTILLO MIRANDA MARIA LUISA,46,2004,ALCALDIA,4
4,ALCALDE MUNICIPAL,4097350000009.0,DE LA A ESCALANTE  GABINO ROGELIO,49,2004,ALCALDIA,4
4,ALCALDE MUNICIPAL,4097350000010.0,BAQUERIZO INTRIAGO CECILIA MARIA,49,2004,ALCALDIA,4
4,ALCALDE MUNICIPAL,4097350000011.0,LARA LOPEZ HUGO FAHARID,55,2004,ALCALDIA,4
4,ALCALDE MUNICIPAL,4097350000012.0,CUENCA DE LA A MANUEL RAUL,49,2004,ALCALDIA,4
4,ALCALDE MUNICIPAL,4097900000001.0,MONTALVO ROBINSON  HUGO IGNACIO,64,2004,ALCALDIA,4
4,ALCALDE MUNICIPAL,4097900000002.0,FIRMAT CHANG JOHNNY RICARDO,40,2004,ALCALDIA,4
4,ALCALDE MUNICIPAL,4097900000003.0,RAMOS PENAFIEL HUGO CLEOFE,51,2004,ALCALDIA,4
4,ALCALDE MUNICIPAL,4097900000004.0,CASTILLO CRESPO YURI GUILLERMO,42,2004,ALCALDIA,4
4,ALCALDE MUNICIPAL,4098200000001.0,FERNANDEZ CORDOVA  WILFRIDO ARTURO,46,2004,ALCALDIA,4
4,ALCALDE MUNICIPAL,4098200000002.0,YUNDA ENRIQUEZ FRANKLIN ERNESTO,49,2004,ALCALDIA,4
4,ALCALDE MUNICIPAL,4098200000003.0,CHAMBA CABANILLA JORGE ENRIQUE,46,2004,ALCALDIA,4
4,ALCALDE MUNICIPAL,4098200000004.0,MENDIETA MARIANA DE JESUS,48,2004,ALCALDIA,4
4,ALCALDE MUNICIPAL,4098200000005.0,PEREZ CEVALLOS GUSTAVO ALBERTO,61,2004,ALCALDIA,4
4,ALCALDE MUNICIPAL,4098200000006.0,ARBOLEDA COELLO LUIS ALFREDO,35,2004,ALCALDIA,4
4,ALCALDE MUNICIPAL,4098200000007.0,MUNOZ RODAS BENIGNO APOLINARIO,83,2004,ALCALDIA,4
4,ALCALDE MUNICIPAL,4098200000008.0,ARANA CABRERA  JOSE NAVAL,54,2004,ALCALDIA,4
4,ALCALDE MUNICIPAL,4098200000009.0,SANTOS MARTINEZ LUIS ARTURO,57,2004,ALCALDIA,4
4,ALCALDE MUNICIPAL,4098200000010.0,LAZO REGATO GERARDO VALERIANO,50,2004,ALCALDIA,4
4,ALCALDE MUNICIPAL,4098350000001.0,ANDAGOYA GARCIA  JEAN ANTONIO,54,2004,ALCALDIA,4
